{
  "schemaVersion": 1,
  "id": "madrid",
  "name": "Madrid",
  "country": "Spain",
  "countryCode": "ES",
  "center": [
    40.4168,
    -3.7038
  ],
  "bbox": [
    40.36,
    -3.78,
    40.48,
    -3.62
  ],
  "timezone": "Europe/Madrid",
  "currency": "EUR",
  "currencySymbol": "€",
  "languages": "Spanish",
  "cityDays": 4,
  "intro": "Spain's capital: three great art museums on one avenue, a royal palace, a huge park and late-night tapas. Compact centre with an excellent metro.",
  "transit": {
    "card": "10-trip ticket on a Multi card",
    "mode": "metro and bus",
    "note": "Metro runs roughly 6:00–1:30."
  },
  "status": "draft",
  "sources": [
    "Written from general knowledge for the MVP; needs a human review before launch"
  ],
  "areas": [
    {
      "id": "sol",
      "name": "Sol & Plaza Mayor",
      "lat": 40.416,
      "lng": -3.706,
      "blurb": "The old centre around kilometre zero."
    },
    {
      "id": "palacio",
      "name": "Royal Palace & Templo de Debod",
      "lat": 40.4195,
      "lng": -3.715,
      "blurb": "Palace, cathedral and the sunset temple."
    },
    {
      "id": "prado",
      "name": "Prado & Paseo del Arte",
      "lat": 40.413,
      "lng": -3.6935,
      "blurb": "The Prado, Reina Sofía and Thyssen on one boulevard."
    },
    {
      "id": "retiro",
      "name": "Retiro Park",
      "lat": 40.416,
      "lng": -3.684,
      "blurb": "Madrid's great park with a boating lake."
    },
    {
      "id": "latina",
      "name": "La Latina & Lavapiés",
      "lat": 40.41,
      "lng": -3.7085,
      "blurb": "Tapas streets and the Sunday flea market."
    },
    {
      "id": "granvia",
      "name": "Gran Vía & Malasaña",
      "lat": 40.4225,
      "lng": -3.702,
      "blurb": "Big avenue, theatres and lively squares."
    },
    {
      "id": "bernabeu",
      "name": "Santiago Bernabéu",
      "lat": 40.4531,
      "lng": -3.6883,
      "blurb": "The Real Madrid stadium in the north."
    }
  ],
  "pois": [
    {
      "id": "prado",
      "name": "Prado Museum",
      "area": "prado",
      "lat": 40.4138,
      "lng": -3.6921,
      "type": "museum",
      "priority": 1,
      "rank": 1,
      "durationMin": 150,
      "kidScore": 1,
      "indoor": true,
      "bestTime": "morning",
      "cost": 2,
      "costNote": "Free in the last two opening hours",
      "site": "museodelprado.es",
      "why": "One of the world's great art museums: Velázquez's Las Meninas, Goya and Bosch.",
      "kid": "Find the tiny painter hiding in Las Meninas (it's Velázquez himself).",
      "tip": "Free entry in the last two hours of the day; the queue starts early."
    },
    {
      "id": "reina-sofia",
      "name": "Reina Sofía Museum",
      "area": "prado",
      "lat": 40.408,
      "lng": -3.6945,
      "type": "museum",
      "priority": 1,
      "rank": 5,
      "durationMin": 120,
      "kidScore": 1,
      "indoor": true,
      "closedDays": [
        "Tue"
      ],
      "cost": 2,
      "site": "museoreinasofia.es",
      "why": "Modern art museum with Picasso's Guernica.",
      "kid": "Guernica is huge: count the animals in the painting.",
      "tip": "Free in the evenings on most days; check the site."
    },
    {
      "id": "thyssen",
      "name": "Thyssen-Bornemisza Museum",
      "area": "prado",
      "lat": 40.416,
      "lng": -3.6949,
      "type": "museum",
      "priority": 2,
      "durationMin": 120,
      "kidScore": 1,
      "indoor": true,
      "cost": 2,
      "site": "museothyssen.org",
      "why": "A private collection that runs from medieval art to Pop Art."
    },
    {
      "id": "cibeles",
      "name": "Cibeles Palace viewpoint",
      "area": "prado",
      "lat": 40.4192,
      "lng": -3.693,
      "type": "view",
      "priority": 2,
      "durationMin": 40,
      "kidScore": 2,
      "indoor": true,
      "closedDays": [
        "Mon"
      ],
      "cost": 1,
      "costNote": "Small fee for the rooftop",
      "why": "The wedding-cake city hall; its rooftop terrace looks down the grand avenues.",
      "kid": "Wave to the goddess Cibeles in her lion-drawn chariot below."
    },
    {
      "id": "caixaforum",
      "name": "CaixaForum vertical garden",
      "area": "prado",
      "lat": 40.4113,
      "lng": -3.6935,
      "type": "sight",
      "priority": 3,
      "durationMin": 15,
      "kidScore": 2,
      "indoor": false,
      "cost": 0,
      "why": "A wall covered in 15,000 living plants beside a floating brick building.",
      "kid": "How many different shades of green can you count?"
    },
    {
      "id": "retiro",
      "name": "Retiro Park & boating lake",
      "area": "retiro",
      "lat": 40.418,
      "lng": -3.683,
      "type": "park",
      "priority": 1,
      "rank": 2,
      "durationMin": 90,
      "kidScore": 3,
      "indoor": false,
      "cost": 0,
      "why": "Madrid's great park: row a boat on the lake below the colonnade monument.",
      "kid": "Row a boat and watch for the turtles on the lake edge.",
      "tip": "Boats are cheapest on weekday mornings."
    },
    {
      "id": "crystal-palace",
      "name": "Palacio de Cristal",
      "area": "retiro",
      "lat": 40.4137,
      "lng": -3.682,
      "type": "sight",
      "priority": 2,
      "durationMin": 20,
      "kidScore": 2,
      "indoor": true,
      "cost": 0,
      "why": "A glass-and-iron pavilion beside a pond in the Retiro.",
      "kid": "Look for the ducks and turtles in the pond outside."
    },
    {
      "id": "puerta-alcala",
      "name": "Puerta de Alcalá",
      "area": "retiro",
      "lat": 40.42,
      "lng": -3.6887,
      "type": "sight",
      "priority": 3,
      "durationMin": 10,
      "kidScore": 1,
      "indoor": false,
      "cost": 0,
      "why": "A granite city gate from 1778 at the corner of the Retiro."
    },
    {
      "id": "royal-palace",
      "name": "Royal Palace",
      "area": "palacio",
      "lat": 40.418,
      "lng": -3.7143,
      "type": "sight",
      "priority": 1,
      "rank": 3,
      "durationMin": 90,
      "kidScore": 1,
      "indoor": true,
      "cost": 2,
      "bookAhead": true,
      "site": "patrimonionacional.es",
      "why": "Western Europe's largest royal palace by floor area, with 3,000+ rooms.",
      "kid": "Find the Stradivarius violins and the armour for kids in the Royal Armoury.",
      "tip": "Free for EU residents late in the afternoon on some days; check the site."
    },
    {
      "id": "almudena",
      "name": "Almudena Cathedral",
      "area": "palacio",
      "lat": 40.4157,
      "lng": -3.7146,
      "type": "sight",
      "priority": 3,
      "durationMin": 30,
      "kidScore": 1,
      "indoor": true,
      "cost": 0,
      "why": "The cathedral facing the palace, with a colourful painted ceiling."
    },
    {
      "id": "plaza-oriente",
      "name": "Plaza de Oriente",
      "area": "palacio",
      "lat": 40.4185,
      "lng": -3.712,
      "type": "park",
      "priority": 3,
      "durationMin": 15,
      "kidScore": 1,
      "indoor": false,
      "cost": 0,
      "why": "Formal gardens with statues of old kings in front of the palace."
    },
    {
      "id": "debod",
      "name": "Templo de Debod",
      "area": "palacio",
      "lat": 40.424,
      "lng": -3.7177,
      "type": "view",
      "priority": 2,
      "durationMin": 30,
      "kidScore": 2,
      "indoor": false,
      "bestTime": "afternoon",
      "cost": 0,
      "why": "A real Egyptian temple, gifted to Spain and rebuilt in a park. Best at sunset.",
      "kid": "This temple is over 2,000 years old and came from Egypt by ship."
    },
    {
      "id": "teleferico",
      "name": "Teleférico cable car",
      "area": "palacio",
      "lat": 40.4262,
      "lng": -3.7193,
      "type": "kids",
      "priority": 3,
      "durationMin": 40,
      "kidScore": 3,
      "indoor": false,
      "cost": 1,
      "why": "A cable car over the trees to the Casa de Campo park.",
      "tip": "Runs on a reduced schedule in winter."
    },
    {
      "id": "plaza-mayor",
      "name": "Plaza Mayor",
      "area": "sol",
      "lat": 40.4155,
      "lng": -3.7074,
      "type": "sight",
      "priority": 1,
      "rank": 4,
      "durationMin": 20,
      "kidScore": 2,
      "indoor": false,
      "cost": 0,
      "why": "The grand arcaded square of old Madrid, once used for bullfights and festivals.",
      "kid": "Find the painted figures on the Casa de la Panadería façade.",
      "tip": "Have a drink one street away; the square's cafés are pricey."
    },
    {
      "id": "san-miguel",
      "name": "Mercado de San Miguel",
      "area": "sol",
      "lat": 40.4154,
      "lng": -3.709,
      "type": "market",
      "priority": 2,
      "durationMin": 40,
      "kidScore": 2,
      "indoor": true,
      "cost": 2,
      "why": "An iron-and-glass market hall full of tapas counters.",
      "kid": "Try a croqueta or two.",
      "tip": "Busy and not cheap; nice for a taste."
    },
    {
      "id": "puerta-del-sol",
      "name": "Puerta del Sol",
      "area": "sol",
      "lat": 40.4169,
      "lng": -3.7035,
      "type": "sight",
      "priority": 2,
      "durationMin": 15,
      "kidScore": 2,
      "indoor": false,
      "cost": 0,
      "why": "The busy square at kilometre zero of Spain's roads.",
      "kid": "Find the bear and strawberry tree statue, the city's symbol, and stand on the km 0 plaque."
    },
    {
      "id": "san-gines",
      "name": "Chocolatería San Ginés",
      "area": "sol",
      "lat": 40.4168,
      "lng": -3.7074,
      "type": "kids",
      "priority": 3,
      "durationMin": 20,
      "kidScore": 3,
      "indoor": true,
      "cost": 1,
      "why": "Since 1894: churros dipped in thick hot chocolate.",
      "kid": "Dip your churro and race to finish before the chocolate cools."
    },
    {
      "id": "gran-via",
      "name": "Gran Vía",
      "area": "granvia",
      "lat": 40.42,
      "lng": -3.702,